{
  "schema": "pne_scheduler.sch_validation_manifest/v1",
  "writer": "experimental_from_scratch",
  "status": "experimental",
  "equipment_executable": false,
  "source_project": {
    "path": "pne_scheduler\\example\\smoke_writer_probe.schproj",
    "sha256": "0001ec20121c21222b8a70701cf16b4331ab1bccb930ac46ecf13801fd558d85"
  },
  "template": null,
  "target_profile": {
    "status": "unspecified",
    "equipment": null,
    "channel_profile": null,
    "ctspro_version": null,
    "sch_version": "0x00010003",
    "cell_profile": {
      "nominal_capacity_mAh": 80.0,
      "v_max": 4.2,
      "v_min": 2.5,
      "max_current_mA": 800.0,
      "formation_capacity_mAh": null
    }
  },
  "output": {
    "path": "pne_scheduler\\example\\smoke_writer_probe.sch",
    "sha256": "2a9681153702135585a63a3187e5f094b938384ca00c7333318ef0fb7ed1631c",
    "size": 6044
  },
  "changed_fields": [],
  "evidence": [],
  "validation": {
    "all_passed": true,
    "checks": [
      {
        "name": "output_written",
        "passed": true
      },
      {
        "name": "output_nonempty",
        "passed": true
      }
    ],
    "structural_reread": "not_run",
    "equipment_smoke_test": "not_run"
  },
  "warnings": [
    "From-scratch builds use a full 0x00010003/1760 header, but step semantics and equipment smoke tests are still incomplete (Gate C2–C5).",
    "No target equipment profile was supplied.",
    "Do not load or execute this file on PNE equipment.",
    "Combinatorial writer probe: packs CCCV charge + CC discharge + LOOP + per-step sampling in one file to minimize the number of physical Gate C5 reopen sessions needed (see planning/GATE_C_EQUIPMENT_SMOKE_CHECKLIST.md)."
  ]
}
